"Place","Want to taste","Tasted","Rating","Review","Timestamp"
"Mala Project","False","True","4","Tried the pork belly and fish dry pit with house fried noodles! The dry pot was 5/5 a very flavorful meat and the fish was incredibly soft. House fried noodles was good too :) would go again! ","2022-07-10 19:43:22.693155+00:00"
"12 Chairs Cafe","False","True","5","Really good food. Always super packed so you should try to make a reservation. I haven’t been for anything other than brunch but it’s pretty flavorful. ","2022-02-22 04:24:34.005983+00:00"
"Max Brenner","False","True","4","Sugar cookie martini was WAY too sweet. ","2022-03-04 04:57:04.746165+00:00"
"JINYA Ramen Bar","False","True","4"," Got the spicy chicken ramen! Packed for a Wednesday night but solid spot ","2022-05-12 12:59:49.784454+00:00"
"Mama Tigre","False","True","5","","2022-03-04 04:57:41.728251+00:00"
"Home Frite","False","True","4","Got boneless wings with an assortment of sauces (they let me pick 5)! Good chicken but the boneless gave me more chicken nug vibes. Would still go back! ","2022-04-23 17:39:52.854436+00:00"
"The Bee & The Biscuit","False","True","5","","2022-08-06 15:52:52.885802+00:00"
"Grana","False","True","4","","2022-05-01 19:19:53.354506+00:00"
"Málà Project","False","True","5","","2022-06-08 00:08:49.745223+00:00"
"Dominique Ansel Bakery","False","True","4","Hot chocolate was really thick (maybe too thick) has a dark chocolate base ","2022-02-26 23:48:08.569704+00:00"
"Cook Out","False","True","5","tbh I'm probably biased but I only get their peanut butter chocolate milkshake and it SLAPS

Never eaten their food though 😵‍💫","2022-05-14 15:06:46.850731+00:00"
"Gong Cha Chantilly","False","True","5","crowded spot for a weekday but solid boba - lots of options! ","2022-05-31 13:03:13.562530+00:00"
"Kyuramen","False","True","5","Ordered on UberEats - very quick delivery & everything came in separate containers to mix yourself (none of that soggy noodle stuff here). Got the Tonkatsu Curry Ramen and it was 10/10! Very flavorful & definitely satisfied my ramen craving. Will go back to try more! ","2022-03-30 16:57:17.812801+00:00"
"Celebration by Rupa Vira","False","True","5","Great drinks and food options, different selection from your typical Indian food spots!","2022-03-04 04:54:22.747696+00:00"
"Adda Indian Canteen","False","True","4","Food was really good. They have unique lamb biryanis inside naan. I haven’t experienced this yet at the indian restaurants I’ve been to. The whole experience was okay in terms of ambiance. Very crowded and they were rushing us to leave. ","2022-02-22 04:32:16.100970+00:00"
"Dominique Ansel Bakery","False","True","5","soft, freshly baked cookies! Lots of different choices in pastries / coffee / drinks ","2022-02-24 18:33:35.102069+00:00"
"Tompkins Square Bagels","False","True","4","really good bagel! ","2022-02-26 23:47:21.716053+00:00"
"Grace Street","False","True","4","Ordered the strawberry / lychee shaved snow! Very large bowl and meant to be a shared dessert. Apparently they have bomb cheesecake - will have to go back to try again ","2022-07-16 17:12:58.180438+00:00"
"Tsurutontan Udon Noodle Brasserie","False","True","5","Great portion sizes. flavorful noodles with tons of options - noodles happy hour Monday - Wednesday all day!! Would def go back again ","2022-07-14 02:44:45.393352+00:00"
"TimeOut Market","False","True","5","Smaller than the other TimeOut Markets that I've been to but definitely hit the spot - we ordered Mexican pancakes, Dan Dan noodles and a biscoff crepe 🤤🤤 would go again! ","2022-06-22 13:11:43.009394+00:00"
"The Tyger","False","True","5","Overall really good. Ambiance and service was great. Food was creative. They said they were small plates, but I thought they were good portion sizes. A bit on the pricier side. ","2022-02-22 04:28:58.296187+00:00"
"Repeal Bourbon and burgers","False","True","4","","2022-08-06 14:29:50.273548+00:00"
"Qahwah House","False","True","5","Got Khaliat Alnahl and a Yemeni Latte (iced)! Great vibes and a perfect place to hang out and catch up with friends ","2022-07-31 22:49:32.996777+00:00"
"Tara Kitchen","False","True","5","I have been to Tara's kitchen 2x in my life but I will drive back up to Troy any day for their Moroccan mint tea and dinner plates served in cute little tajins 🧿","2022-05-17 13:53:48.407315+00:00"
"KIKI","False","True","3","Definitely think people go for the vibes - food was okay, don't think it was worth the extra $$$ for vibes and sub par food ","2022-06-20 16:15:28.554872+00:00"
"Baazi","False","True","5","Got the butternut squash kofta, garlic naan, & mezcal passion! Kofta was very creamy and soft. Overall good vibes, service, and food! Would definitely return 😋","2022-07-18 01:55:40.165998+00:00"
"Thai Tyme","False","True","4","Did carry out! Papaya salad, drunken noodles and red curry - was pretty solid for take out. Noticed I had picked vegetarian options and called to ensure I was okay with fish oil, they definitely ensure they take all dietary restrictions into account even with take out. Would definitely go dine in next time. ","2022-05-09 02:35:26.378043+00:00"
"Have & Meyer","False","True","4","hole in the wall italian restaurant &  wine bar, ordered the gnocchi with white truffle and cheddar and trenette with pesto sauce and cherry tomatoes. Was SO good (but we were also starving). They have a very large selection of wines, perfect little dinner spot! ","2022-07-14 01:47:17.148303+00:00"
"The Taco Stand","False","True","5","Hole in the wall taco joint in Wynwood - lengthy line but food came out pretty quickly! Would go again ","2022-06-20 16:17:26.278426+00:00"
"The Halal Guys","False","True","3","","2022-02-25 16:12:18.512920+00:00"
"Gumption Coffee","False","True","4","Got an iced chai latte! Small location l, did the job but wasn't anything life changing ","2022-08-10 13:30:05.510108+00:00"
"a’Bouzy","False","True","4","French restaurant - no brunch menu other than the weekend! Good ambiance and staff! ","2022-04-21 17:07:37.625483+00:00"
"Gazab","False","True","5","Great ambiance, good food, and quick service. Very crowded / small space so definitely reserve in advance for a larger group ","2022-03-06 01:26:31.207689+00:00"
"Doughnut Vault","False","True","5","Open from 8-1 and after noon all leftover donuts are 50% off!! So goood - lots of flavors and not overly sweet. Highly recommend! ","2022-06-24 18:09:00.872398+00:00"
"Velvet Taco","False","True","5","Ranch water drink (tequila in topo chico) + cauliflower taco + spicy tikka chicken 

REALLY good tacos! ","2022-04-21 17:10:10.357420+00:00"
"Tava Fry","False","True","4","Paneer Kati roll","2022-04-09 22:59:03.376614+00:00"
"Chennai Express","False","True","4","small restaurant but their dosa / samosas / South Indian Tea snacks always slap! Perfect for the afternoon pick me up - recommend take out for sure. ","2022-05-31 13:00:38.479892+00:00"
"Zaytinya","False","True","4"," ","2022-05-30 15:45:39.803338+00:00"
"Friend of a Farmer","False","True","5","Farm to table concept and some of the BEST brunch food I've ever hard. lines are super long on weekends - so try to make a reservation before going! 

Been here two times already and wouldn't hesitate to go again. ","2022-05-27 02:43:39.486505+00:00"
"Xixa","False","True","5","","2022-02-24 18:30:25.438006+00:00"
"Dig Inn","False","True","5","very clean / healthy! lots of bowl options & sides. Seems like this is more of a take out or delivery place. Went in to grab dinner and they were pretty overwhelmed. 

Would definitely go back again","2022-03-24 16:18:02.342782+00:00"
"Jajaja","False","True","4","Thought the burrito was a tad overhyped and bland","2022-02-24 18:34:16.238332+00:00"
"Good Chef","False","True","4","Ordered the scallion pancakes and Dan Dan noodles! cute hole in the wall restaurant inside an Asian super market - very unique set up. Super packed for a Wednesday night but the service was very quick and seamless. Dan Dan noodles were very flavorful - portion sizes were pretty big, took a decent amount of left overs home","2022-06-30 02:16:24.496377+00:00"
"Amorino Gelato","False","True","5","amazing gelato, great music selection! ","2022-07-29 21:06:20.691992+00:00"
"AÑEJO","False","True","4","Memorable place. For bottomless there was never an empty glass so service was great. They also gave bottomless coconut pancakes and potatoes which were so good. ","2022-02-22 04:27:37.306035+00:00"
"Village Taverna Greek Grill","False","True","4","Very solid Greek food option, minimal chicken entree choices. May not be very vegetarian friendly! Good portion sizes and large wine selection ","2022-07-29 21:05:45.766147+00:00"
"Nathan's Dairy Bar","False","True","5","My go to ice cream spot - been coming here for 15+ years, always the best ","2022-05-16 14:31:32.482369+00:00"
"The Mean Fiddler","False","True","4","Great food! Turns into club / party vibes later at night ","2022-02-28 17:02:19.887856+00:00"
"First Watch","False","True","4","Pretty crowded for a Thursday morning! Pretty solid food, good selection and fresh. We ordered two different kinds of French toast and @parth and I both ordered the skillet hash - potatoes were very flavorful. Ordered the Pineapple Express and it was a very refreshing drink! Priyanka got something with beet and turmeric which she really enjoyed but I was not a fan lmao 

Would return for a quick bite to eat especially since local! ","2022-05-26 16:31:36.110093+00:00"
"RAMEN-SAN - River North","False","True","5","my favorite ramen spot in Chicago! ","2022-05-31 14:10:02.935975+00:00"
"Au Za’atar","False","True","4","One of the better Lebanese restaurants. Service was okay, but maybe it’s because we were seated outside. Shawarma was not dry which was good. ","2022-02-22 04:25:38.130929+00:00"
"Toast","False","True","5","Ginger beer is SO good. Toast is locally made & fresh every morning. Big portion sizes - good food","2022-03-21 15:18:45.347000+00:00"
"Duke's Grocery","False","True","4","90 minute bottomless! American brunch place, good service / decent brunch selection. Ordered the truffle Mac & cheese - was pretty rich with the truffle oil but still good","2022-04-09 23:00:01.865422+00:00"
"Tacombi - Fort Greene","False","True","3","was alright, chicken was kind of dry and tacos weren't very filling. 
service wasn't too great","2022-03-22 03:50:41.324810+00:00"
"Gypsy Kitchen DC","False","True","3","","2022-05-08 22:55:34.295498+00:00"
"B'klyn Burro","False","True","4","filling burrito - honestly was just okay, have had better","2022-03-15 01:48:56.941412+00:00"
"Cantina Laredo","False","True","4","go","2022-05-15 02:03:54.288093+00:00"
"The Butcher's Daughter","False","True","4","pretty strict with their reservation times - great assortment of bowls and drinks! pretty crowded and not much seating so everyone's listening to each other's conversations lol ","2022-05-27 02:45:52.838099+00:00"
"KONOS","False","True","5","very fresh gelato! So flavorful - got the passion fruit and mango for a fruity fix and it was so good 🤤","2022-07-01 22:27:29.648137+00:00"
"Rangoon","False","True","4","Got the Chicken & squash curry and spicy mee shay noodles! Was very flavorful - loved the quiet and cozy atmosphere, service was also great. Would go back again to try everything else! ","2022-08-18 15:07:14.745017+00:00"
"Bushwick Taco Company","False","True","4","my new taco / burrito quick fix spot! ","2022-08-18 15:16:37.650130+00:00"
"Falafel Inc","False","True","5","Hole in the wall falafel shop near M street - pretty packed but they work quickly! Ordered the Falafel sandwich + hummus and fries. They don't have a sit down area so be prepared to take the food and go 😋","2022-05-19 04:21:04.883762+00:00"
"The Yard Milkshake Bar, Inc.","False","True","4","I slightly agree with Parth's review about it just being an IG trap - but they have two different locations (Va beach and One Loudoun). Surprisingly the NoVA location is ALWAYS crowded - slightly overpriced for a milkshake and the mason jar but I think everyone should go atleast once for the experience itself. I don't think the milkshakes are life changing but they are certainly good! ","2022-05-17 13:43:30.957470+00:00"
"Woodlands Pure Vegetarian Indian Cuisine","False","True","5","Sambar Vada + Butter Masala Dosa -- been coming here for 15+ years, if you're looking for South Indian food that takes you back to the good old days of eating at your lovely grandmothers house then this is it!  never a bad meal ","2022-05-06 19:14:12.217414+00:00"
"Brooklyn Farmacy & Soda Fountain","False","True","5","Ordered a cherry cola float! Very cute and old school soda fountain shop - pharmacy turned to cola / soda shop. Immaculate vibes! Would definitely return","2022-07-29 21:04:47.450839+00:00"
"Joe's Pizza","False","True","5","see @gitas review :) ","2022-07-31 22:48:11.193166+00:00"
"Sense of Thai St","False","True","5","Easily one of my favorite Thai restaurants in NoVa! ","2022-05-09 21:00:35.367825+00:00"
"Guevara's","False","True","5","Got the Milanese torta, breakfast burrito and a guava cinnamon latte! Have ordered take out from here before but was my first time eating there - very cute decor and seating! Was packed for a Sunday morning and have a large assortment of food / pastries / drinks. The latte was 10/10. Would definitely return! ","2022-07-10 19:48:52.882374+00:00"
"Rubirosa Ristorante","False","True","4","Food and service was great! Wait time was a bit long and they don't take reservations so plan on waiting in the area to not lose your spot in line ","2022-02-24 18:31:38.143342+00:00"
"Mojo Restaurant","False","True","4","Really good and wide selection of drinks. Service and music was great. Little overpriced but worth. ","2022-02-22 04:22:47.364623+00:00"
"El Tucán","False","True","5","Very cool vibes - jungle themed restaurant, great food & drinks. Super packed! Definitely on the expensive side but think it's worth it as a one time thing ","2022-06-20 16:16:22.258126+00:00"
"Agave","False","True","3","Wasn’t a huge fan. Super packed and even though we had a reservation, we ended up waiting awhile. Food wasn’t even that good. ","2022-02-22 04:26:33.707641+00:00"
"Levain Bakery","False","True","4","Large, chunky gooey cookies ","2022-03-14 21:40:44.898656+00:00"
"Portillo's","False","True","5","Garden veggie hot dog, onion rings and cheese fries! Honestly 10/10 ","2022-06-27 19:37:44.107768+00:00"
"Baar Baar","False","True","4","","2022-02-24 18:32:11.780076+00:00"
"The Asian Kitchen","False","True","4","Veggie spring rolls & Lo Mein -- was solid and satisfied the Chinese take out craving ","2022-06-21 17:13:56.223493+00:00"
"Artichoke Basille's Pizza","False","True","4","Got pizza to go and ate it at little island! On the corner of the high line and Chelsea market - pizza slices were massive - literally bigger than my face! we got a slice of staten island (classic red) and artichoke spinach (white cheese) which was VERY cheesy. 

the staten island had a very good sauce to pizza ratio, solid mozzarella situation with some sausage. ","2022-07-07 23:46:27.554746+00:00"
"Strawberry Fields","False","True","5","Priyanka got a custom ginger cinnamon gelato made for Parths birthday & it was HEAVENLY ","2022-05-17 13:44:42.178030+00:00"
"Zaytoons","False","True","4","Ordered takeout of Chicken shawarma platter and a falafel sandwich! Both tasted really good - the portion size was okay, wish there was a bit more food but would recommend and go again! 

Also cash only, but they have an ATM inside. ","2022-07-07 23:40:04.845686+00:00"
"Pommes Frites","False","True","5","amazing fries and wide selection of sauces ","2022-03-15 01:46:59.836441+00:00"
"The Gully","False","True","3","It’s a bit overwhelming. Crowded and music is too loud. Food was average though. ","2022-02-22 04:29:47.261495+00:00"
"Mala Project","False","True","4","Dan Dan noodles were really good! Lots of flavor and spice, easily shareable with people. 

Wasn't a huge fan of the chicken dry pot, very tough meat and not much variety. Think it would be more worth to build your own dry pot instead! ","2022-02-26 16:12:39.335557+00:00"
"Rasika","False","True","5","went for my birthday dinner with my family and thought it was great! Was SO full at the end of the meal & they brought us gulab jamun and ice cream at the end 🤩","2022-06-07 21:26:36.390182+00:00"
"Barcelona Wine Bar","False","True","5","Good sangria! tapas bar - lots of good options! Flan is phenomenal ","2022-05-01 19:19:34.752104+00:00"
"Lolita","False","True","4","Good vibes and drinks, definitely a fun dinner place. Ordered cauliflower tacos, Mexican fried rice and street corn! Crowded so make a res in advance! Had bumpin music lol - would definitely return ","2022-04-30 16:43:17.698843+00:00"
"Añejo Tribeca","False","True","5","Amazing food, service and vibes! 10/10 ","2022-04-29 01:40:25.456468+00:00"
"The Rustic","False","True","4","They have a fixed brunch menu of 9 items - was a bit difficult to accommodate dietary restrictions as they can't substitute the items. Overall still very good! Highly recommend. ","2022-04-21 17:08:51.869539+00:00"
"Mercadito","False","True","4","Ordered hongas tacos, Mexican corn, and chipotle mango guac! very flavorful and fresh ingredients :) they gave us a variety of salsa and chips for the table! Would definitely go again ","2022-06-27 19:36:37.187731+00:00"
"Taste Unlimited","False","True","4","Good portion size, filling sandwich","2022-03-21 15:22:21.228543+00:00"
"Sisters","False","True","4","Fried pickles, veggie burger and risotto! I had been craving risotto for over a week & finally got my fix. The veggie burger patty was also handmade and very fresh - would definitely go back to try something else :) very cute rustic interior! ","2022-08-02 01:57:59.310256+00:00"
"Torchy's Tacos","False","True","4","Good tacos! Classic Texas taco spot ","2022-03-26 05:03:09.945146+00:00"
"Taco Bell","False","True","4","Mexican pizza 5/5 & they let you take as much hot sauce as you want ","2022-05-18 01:45:58.984419+00:00"
"Gupshup","False","True","4","Good drinks and vibes, service was good. Nothing special but good experience to have. ","2022-02-22 04:23:23.308835+00:00"
"The Horny Ram","False","True","3","went for bottomless brunch & was honestly expecting more. People have raved about this place - maybe it was just for vibes and the name lol but thought the food was dry / not as good as I imagined. They def kept the bottomless coming though which is a plus! Make a res in advance if you wanna check it out or don't lol I don't think you're missing out on much ","2022-06-07 21:17:56.137195+00:00"
"12 Chairs Cafe","False","True","5","Always a fantastic meal ","2022-07-31 22:48:35.266076+00:00"
"Ralph's Coffee","False","True","5","great coffee, cute decor! ","2022-04-03 00:22:59.926836+00:00"
"Alkaline","False","True","4","Green bean salad was good, flavorful but a little too salty. Red curry ramen was unique!! Just a tad spicy","2022-03-21 15:17:52.510545+00:00"
"Tatte Bakery & Cafe","False","True","5","Great food & coffee! Lots of pastry and breakfast choices. location at Harvard Square is really crowded but a great spot to study or chill with friends ","2022-05-01 19:18:59.570075+00:00"
"Adda Indian Canteen","False","True","5","Never lets me down ","2022-07-17 16:56:05.604675+00:00"
"Versailles","False","True","4","authentic Cuban cuisine - very packed for a Sunday night, waited 30 mins to be seated but very fast service. Food was good, Cortadito was 😍 will definitely go back! 

","2022-06-20 16:14:25.839302+00:00"
"TALEA Beer Co.","True","False","","",""
"Dua Kafe","True","False","","",""
"Alta","True","False","","",""
"ilili Restaurant","True","False","","",""
"Empanada Mama","True","False","","",""
"Soothr Thai Noodle Bar","True","False","","",""
"Veselka","True","False","","",""
"Thai Villa","True","False","","",""
"Dhamaka","True","False","","",""
"Our Mom Eugenia","True","False","","",""
"Bruster's Real Ice Cream","True","False","","",""
"Carbone","True","False","","",""
"The Sandwich Shop","True","False","","",""
"Giano Restaurant","True","False","","",""
"Cutlets Sandwich Co.","True","False","","",""
"Ruby's","True","False","","",""
"Buddakan","True","False","","",""
"Fan-Fan Doughnuts","True","False","","",""
"Chavela's","True","False","","",""
"Clementine Bakery","True","False","","",""
"Ramen Danbo","True","False","","",""
"Surreal Creamery","True","False","","",""
"Marumi Japanese Restaurant","True","False","","",""
"Enoteca Maria","True","False","","",""
